<?xml version="1.0" encoding="UTF-8"?>
<!DOCTYPE member SYSTEM "member.dtd">
<member>
	<list no="a1">
		<id>jini</id>
		<name>jieun</name>
		<home>신림</home>
		<from/>
	</list>
	<list no="a2">
		<id>jini</id>
		<name>jieun</name>
		<home>신림</home>
		<from/>
	</list>
	<list no="a3">
		<id>jini</id>
		<name>jieun</name>
		<home>신림</home>
		<from/>
	</list>
	<list no="a4">
		<id>jini</id>
		<name>jieun</name>
		<home>신림</home>
		<from/>
	</list>
	<list no="a5">
		<id>jini</id>
		<name>jieun</name>
		<home>신림</home>
		<from/>
	</list>
</member>